{
  "schemaVersion": "clearcutt.catalog.index/v1",
  "generatedAt": "2026-05-29T20:00:00Z",
  "generator": {
    "name": "clearcutt",
    "version": "test",
    "commit": "fixture"
  },
  "source": {
    "owner": "test-owner",
    "repo": "test-repo",
    "repoUrl": "https://github.com/test-owner/test-repo",
    "registryBase": "ghcr.io/test-owner/test-repo"
  },
  "summary": {
    "imageCount": 1,
    "releaseCount": 1,
    "signedCount": 1,
    "provenanceCount": 1,
    "sbomCount": 1,
    "scanCount": 1,
    "passingCount": 1
  },
  "owner": "test-owner",
  "repo": "test-repo",
  "repoUrl": "https://github.com/test-owner/test-repo",
  "registryBase": "ghcr.io/test-owner/test-repo",
  "latestTag": "v1.0.0",
  "releases": [
    { "tag": "v1.0.0", "publishedAt": "2026-05-29T20:00:00Z", "isLatest": true }
  ],
  "languages": [
    { "id": "java", "displayName": "Java", "version": "21", "icon": null }
  ],
  "tiers": [
    { "id": "distroless", "name": "Distroless", "blurb": "Hardened tier" }
  ],
  "images": [
    {
      "id": "java21-distroless",
      "language": "java",
      "languageDisplay": "Java",
      "languageVersion": "21",
      "tier": "distroless",
      "latestTag": "v1.0.0",
      "latestManifestDigest": "sha256:1234567890abcdef1234567890abcdef1234567890abcdef1234567890abcdef",
      "latestPackageCount": 42,
      "architectures": ["amd64", "arm64"],
      "signed": true,
      "provenance": true,
      "passed": true,
      "evidence": {
        "signature": true,
        "provenance": true,
        "sbom": true,
        "tests": true,
        "vulnerabilities": true,
        "archCount": 2,
        "sbomArchCount": 2,
        "testArchCount": 2,
        "passedTestArchCount": 2,
        "vulnerabilityArchCount": 2
      },
      "lifecycle": {
        "status": "active",
        "support": "lts",
        "productionAllowed": true,
        "deprecatedAt": null,
        "eolAt": null,
        "reason": null
      },
      "runtimeContract": {
        "user": "10001",
        "workingDir": "/app",
        "shellPresent": false,
        "packageManagerPresent": false,
        "caCertificatesPresent": true,
        "timezoneDataPresent": true,
        "defaultEntrypoint": "/usr/local/bin/java",
        "productionTier": true
      }
    }
  ]
}
